{
  "schema_version": 2,
  "comparison_id": "XCMP-AMRVAC-SHOCK",
  "dataset_provenance_id": "Q022-DATASET-XCMP-AMRVAC-SHOCK",
  "freeze_status": "blocked_pending_reference_dataset_extraction_and_external_review",
  "observable_families": ["shock_morphology", "precursor_structure", "spectra", "amr_behavior", "setup_differences"],
  "rows": [],
  "blocked_inputs": [
    "No authorized Orion extracted dataset exists for this comparison.",
    "Reference-specific units, extraction uncertainty, and externally reviewed numerical thresholds remain unavailable.",
    "Numeric tolerance rows are intentionally absent rather than fabricated."
  ],
  "reviewer_disposition": "pending external review"
}
