{
  "schema_version": 2,
  "comparison_id": "XCMP-EXT-HALL-BELL",
  "dataset_provenance_id": "Q022-DATASET-XCMP-EXT-HALL-BELL",
  "freeze_status": "blocked_pending_reference_dataset_extraction_and_external_review",
  "observable_families": ["derived_hall_dispersion", "nonlinear_amplification", "hall_applicability", "shock_front_metrics"],
  "rows": [],
  "blocked_inputs": [
    "No authorized Orion extracted dataset exists for this comparison.",
    "Reference-specific units, extraction uncertainty, reviewed physical Hall coefficients, analysis windows, and externally reviewed numerical thresholds remain unavailable.",
    "Numeric tolerance rows are intentionally absent rather than fabricated."
  ],
  "reviewer_disposition": "pending external review"
}
